{
  "schema_version": "tool_operation.check_result.v1",
  "operation_key": "creator-run-smoke",
  "verdict": "pass",
  "allowed": true,
  "claim_boundary": "tool_operation local postcondition check only",
  "checks": [
    {
      "name": "command_present",
      "status": "pass",
      "message": "Command is present."
    },
    {
      "name": "protected_command",
      "status": "pass",
      "message": "Command is allowed by the local manifest."
    },
    {
      "name": "secret_boundary",
      "status": "pass",
      "message": "No secret/token handling request detected."
    },
    {
      "name": "operation_supported",
      "status": "pass",
      "message": "Operation `creator-run-smoke` is supported."
    },
    {
      "name": "parsed_result",
      "status": "pass",
      "message": "Parsed JSON result is present."
    },
    {
      "name": "packet_kind",
      "status": "pass",
      "message": "creator-run-smoke result has expected packet kind."
    },
    {
      "name": "required_fields",
      "status": "pass",
      "message": "Required result fields are present."
    },
    {
      "name": "success_value",
      "status": "pass",
      "message": "verdict is an allowed success value."
    },
    {
      "name": "evidence_mode",
      "status": "pass",
      "message": "Smoke result evidence_mode matches command mode `recomputed`."
    },
    {
      "name": "expected_postconditions_present",
      "status": "pass",
      "message": "Expected postconditions are declared."
    },
    {
      "name": "expected_verdict",
      "status": "pass",
      "message": "Result verdict matches expected `ready_for_swarm_packet`."
    },
    {
      "name": "expected_no_blocking_checks",
      "status": "pass",
      "message": "Result has no blocking checks."
    },
    {
      "name": "expected_no_missing_paths",
      "status": "pass",
      "message": "Result has no missing paths."
    },
    {
      "name": "expected_automation_blocked",
      "status": "pass",
      "message": "automation.blocked matches expected `False`."
    },
    {
      "name": "rollback_note",
      "status": "pass",
      "message": "Rollback note is present when required."
    }
  ],
  "blocking_checks": [],
  "rollback_note": "",
  "rollback_report": {
    "required": false,
    "provided": false,
    "note": "",
    "operation_key": "creator-run-smoke",
    "blocked_state_update": false,
    "blocking_checks": [],
    "result_verdict": "ready_for_swarm_packet",
    "recommendation": "Mission trace may record this operation result."
  },
  "next_actions": [
    "Record the parsed result and postcondition check with the mission trace."
  ]
}